Sheet: data
A1: sport | B1: objectivity | C1: physical_exertion | D1: mental_exertion | E1: total | F1: notes | G1: should be a sport
A2: triathalon | B2: 12 | C2: 12 | D2: 6 | E2: of:=SUM([.B2:.D2]) -> 30
A3: tour de france | B3: 12 | C3: 12 | D3: 6 | E3: of:=SUM([.B3:.D3]) -> 30
A4: crew | B4: 12 | C4: 12 | D4: 5 | E4: of:=SUM([.B4:.D4]) -> 29 | G4: yes
A5: marathon | B5: 12 | C5: 11 | D5: 6 | E5: of:=SUM([.B5:.D5]) -> 29
A6: swim | B6: 12 | C6: 12 | D6: 4 | E6: of:=SUM([.B6:.D6]) -> 28
A7: track and field | B7: 12 | C7: 10 | D7: 4 | E7: of:=SUM([.B7:.D7]) -> 26 | G7: yes
A8: boxing | B8: 8 | C8: 10 | D8: 8 | E8: of:=SUM([.B8:.D8]) -> 26 | F8: youre pushing yourself to the limits
A9: archery | B9: 9 | C9: 8 | D9: 9 | E9: of:=SUM([.B9:.D9]) -> 26
A10: sailing | B10: 9 | C10: 7 | D10: 10 | E10: of:=SUM([.B10:.D10]) -> 26 | F10: more objective than esports (olympic) but less than chess. About the same as sailing, youre sitting on a vehicle most of the time but still moving around
A11: lumberjack | B11: 10 | C11: 10 | D11: 5 | E11: of:=SUM([.B11:.D11]) -> 25
A12: rock climbing | B12: 10 | C12: 10 | D12: 5 | E12: of:=SUM([.B12:.D12]) -> 25 | F12: its timed but maybe with style points
A13: water polo | B13: 9 | C13: 10 | D13: 6 | E13: of:=SUM([.B13:.D13]) -> 25 | F13: you arent swimming fast all the time
A14: microsoft excel | B14: 10 | C14: 4 | D14: 10 | E14: of:=SUM([.B14:.D14]) -> 24
A15: chess | B15: 10 | C15: 3 | D15: 11 | E15: of:=SUM([.B15:.D15]) -> 24 | F15: conclusive but not based on nature. You move your whole arm, not just a finger
A16: basketball | B16: 9 | C16: 8 | D16: 6 | E16: of:=SUM([.B16:.D16]) -> 23
A17: hot dog eating contest | B17: 9 | C17: 10 | D17: 3 | E17: of:=SUM([.B17:.D17]) -> 22 | F17: theres strategy with how/when you drink water etc. number of hotdogs eaten in time | G17: no
A18: soccer (football) | B18: 9 | C18: 7 | D18: 6 | E18: of:=SUM([.B18:.D18]) -> 22 | F18: goalkeeper doesn t move, so on average less movement
A19: football (american) | B19: 8 | C19: 8 | D19: 6 | E19: of:=SUM([.B19:.D19]) -> 22 | F19: many different ways to get points = more arbitrary
A20: pool | B20: 9 | C20: 4 | D20: 9 | E20: of:=SUM([.B20:.D20]) -> 22
A21: FPS esports | B21: 8 | C21: 5 | D21: 9 | E21: of:=SUM([.B21:.D21]) -> 22 | F21: more arbitrary than chess
A22: badminton | B22: 9 | C22: 8 | D22: 4 | E22: of:=SUM([.B22:.D22]) -> 21
A23: tennis | B23: 9 | C23: 8 | D23: 4 | E23: of:=SUM([.B23:.D23]) -> 21
A24: baseball | B24: 9 | C24: 7 | D24: 5 | E24: of:=SUM([.B24:.D24]) -> 21 | F24: some people stand around most of the game
A25: gymnastics | B25: 4 | C25: 12 | D25: 5 | E25: of:=SUM([.B25:.D25]) -> 21 | F25: more athletic than performative
A26: ping pong | B26: 9 | C26: 6 | D26: 6 | E26: of:=SUM([.B26:.D26]) -> 21
A27: polo | B27: 9 | C27: 6 | D27: 6 | E27: of:=SUM([.B27:.D27]) -> 21
A28: golf | B28: 9 | C28: 5 | D28: 7 | E28: of:=SUM([.B28:.D28]) -> 21 | F28: lower HR average than FPS esports. | G28: no
A29: sumo | B29: 7 | C29: 8 | D29: 5 | E29: of:=SUM([.B29:.D29]) -> 20
A30: wrestling | B30: 6 | C30: 9 | D30: 5 | E30: of:=SUM([.B30:.D30]) -> 20
A31: tetris | B31: 8 | C31: 2 | D31: 10 | E31: of:=SUM([.B31:.D31]) -> 20
A32: bowling | B32: 9 | C32: 6 | D32: 4 | E32: of:=SUM([.B32:.D32]) -> 19 | F32: less physical than basketball
A33: figure skating | B33: 3 | C33: 10 | D33: 4 | E33: of:=SUM([.B33:.D33]) -> 17 | F33: more performative than athletic
A34: spelling bee | B34: 4 | C34: 4 | D34: 9 | E34: of:=SUM([.B34:.D34]) -> 17 | F34: you get on stage, so its more physical than tetris | G34: no
A35: dance | B35: 3 | C35: 9 | D35: 4 | E35: of:=SUM([.B35:.D35]) -> 16
A36: reading | C36: 3 | E36: of:=SUM([.B36:.D36]) -> 3 | G36: no
A37: jump rope | E37: of:=SUM([.B37:.D37]) -> 0
E38: of:=SUM([.B38:.D38]) -> 0
E39: of:=SUM([.B39:.D39]) -> 0
E40: of:=SUM([.B40:.D40]) -> 0
E41: of:=SUM([.B41:.D41]) -> 0
E42: of:=SUM([.B42:.D42]) -> 0
E43: of:=SUM([.B43:.D43]) -> 0
E44: of:=SUM([.B44:.D44]) -> 0
E45: of:=SUM([.B45:.D45]) -> 0
E46: of:=SUM([.B46:.D46]) -> 0
E47: of:=SUM([.B47:.D47]) -> 0
E48: of:=SUM([.B48:.D48]) -> 0
E49: of:=SUM([.B49:.D49]) -> 0
E50: of:=SUM([.B50:.D50]) -> 0
E51: of:=SUM([.B51:.D51]) -> 0
E52: of:=SUM([.B52:.D52]) -> 0
E53: of:=SUM([.B53:.D53]) -> 0
E54: of:=SUM([.B54:.D54]) -> 0
E55: of:=SUM([.B55:.D55]) -> 0
E56: of:=SUM([.B56:.D56]) -> 0
E57: of:=SUM([.B57:.D57]) -> 0
E58: of:=SUM([.B58:.D58]) -> 0
E59: of:=SUM([.B59:.D59]) -> 0
E60: of:=SUM([.B60:.D60]) -> 0
E61: of:=SUM([.B61:.D61]) -> 0
E62: of:=SUM([.B62:.D62]) -> 0

Sheet: Sheet2
A1: 0
A2: 1
A3: 2
A4: 3
A5: 4
A6: 5
A7: 6
A8: 7
A9: 8
A10: 9
A11: 10
A12: 11
A13: 12